source	date	quote	quote_lemmatized	values	values_minimal
2	20150429	An diesem Tag will die Brüsseler Behörde ihr schon lange geplantes Maßnahmenpaket zur Migrationspolitik vorlegen.	Tag Brüsseler Behörde schon lange geplant Maßnahmenpaket Migrationspolitik vorlegen 	['500', '501']	{'5'}
2	20150429	"Die EU müsse sich  ""dringend""  mit der legalen Migration beschäftigen."	EU müssen   dringend   legal Migration beschäftigen 	['100', '101', '108', '500', '501']	{'5', '1'}
2	20150429	"Ganz anders die Grünen:  ""Wir brauchen humanitäre Visa und die Aufnahme von mehr Flüchtlingen aus den Nachbarländern Syriens"" , so die Abgeordnete Ska Keller."	ganz grüne   brauchen humanitär Visa Aufnahme mehr Flüchtling Nachbarland Syrien abgeordneter Ska Keller 	['100', '101', '113']	{'1'}
2	20150429	Parlamentspräsident Martin Schulz (SPD) forderte die EU-Regierungen auf, dem Parlament in der Debatte um die Flüchtlingskrise endlich mehr Gehör zu schenken.	Parlamentspräsident Martin Schulz SPD fordern EU-Regierung Parlament Debatte Flüchtlingskris endlich mehr Gehör schenken 	['800', '899']	{'8'}
2	20150803	"""Ziel ist es, die Anzahl von Asylsuchenden stark zu veringern"" , sagt Marcus Knuth, einwanderungspolitischer Sprecher der dänischen Regierungspartei Venstre."	Ziel Anzahl Asylsuchender stark veringern sagen Marcus Knuth einwanderungspolitisch Sprecher dänisch Regierungspartei Venstre 	['100', '102']	{'1'}
2	20150803	"""Stoppt diese Pläne"" , forderten die Manager mehrerer großer Unternehmen die Regierung Ende vergangener Woche in einer gemeinsamen Erklärung auf:  ""Diese Initiative wird dazu führen, dass Dänemark nicht reicher, sonder ärmer wird."""	Stoppt Plan fordern Manager mehrere groß Unternehmen Regierung Ende vergangen Woche gemeinsam Erklärung   Initiative führen Dänemark reich sond arm 	['100', '102']	{'1'}
2	20150803	Man hätte zwar schon die Annoncen der Bundesregierung kritisiert, sagte Tobias Klaus von der deutschen Flüchtlingshilfeorganisation Pro Asyl gegenüber Politiken:	schon Annonce Bundesregierung kritisieren sagen Tobias Klaus deutsch Flüchtlingshilfeorganisation pro Asyl gegenüber Politiken 	['100', '102', '700', '707']	{'7', '1'}
2	20150803	"Im Juni schaltete die deutsche Botschaft in Tirana Anzeigen mit der Überschrift:  ""Kein Wirtschaftsasyl in Deutschland"" ."	Juni schalten deutsch Botschaft Tirana Anzeige Überschrift   Wirtschaftsasyl Deutschland 	['100', '102', '700', '707']	{'7', '1'}
2	20150803	"Das Signal ist in erster Linie  ""an Menschenschmuggler gerichtet, die eine große Anzahl Asylsuchende nach Dänemark schicken,""  beteuert Knuth."	Signal erster Linie   Menschenschmuggler richten groß Anzahl Asylsuchender Dänemark schicken   beteuern Knuth 	['100', '109']	{'1'}
2	20150803	"Eine Facebook-Kampagne sammelt mittlerweile Gelder für Gegenannoncen unter dem Motto  ""Flüchtlinge willkommen!"""	Facebook-Kampagne sammeln mittlerweile Geld Gegenannonce Motto   Flüchtling willkommen 	['700', '705']	{'7'}
2	20150803	"Auch könne sich Dänemark ein Vorbild an Österreich nehmen, das Flüchtlinge geschickt ins Nachbarland Slowakei  ""exportiert"" ."	Dänemark Vorbild Österreich nehmen Flüchtling geschickt Nachbarland Slowakei   exportieren 	['200', '207']	{'2'}
2	20150701	Zuletzt hatte man Anfang Juli angekündigt, die finanzielle Unterstützung für Asylsuchende und deren Familien nahezu zu halbieren.	zuletzt Anfang Juli ankündigen finanziell Unterstützung Asylsuchender Familie nahezu halbieren 	['300', '309']	{'3'}
2	20150803	"Der Dänischen Volkspartei, auf deren parlamentarische Unterstützung die Venstre-Minderheitsregierung angewiesen ist, reicht eine Annoncenkampagne nicht. Kopenhagen solle die  ""No Way!"" -Aktion Australiens kopieren, eine Plakataktion starten und Videos produzieren, in denen man in englischer und arabischer Sprache Flüchtlinge auffordere, nicht nach Dänemark zu kommen."	dänisch Volkspartei parlamentarisch Unterstützung Venstre-Minderheitsregierung anweisen reichen Annoncenkampagne Kopenhagen sollen   Way -Aktion Australien kopieren Plakataktion starten Video produzieren englisch arabisch Sprache Flüchtling aufforderen Dänemark kommen 	['100', '104']	{'1'}
2	20150201	Und eine ähnliche Kampagne hatte Österreich im Februar in kosovarischen Medien gestartet.	ähnlich Kampagne Österreich Februar kosovarisch Medium starten 	['100', '102', '700', '707']	{'7', '1'}
2	20150803	Das Land brauche neue Arbeitskräfte und solch eine Abwehrhaltung drohe sich negativ auf den internationalen Ruf Dänemarks auszuwirken und könne mithin Exportanstrengungen unterminieren.	Land brauchen neu Arbeitskraft solch Abwehrhaltung drohen negativ international Ruf Dänemark auszuwirken mithin exportanstrengungen unterminieren 	['100', '104']	{'1'}
2	20150803	Das Land brauche neue Arbeitskräfte und solch eine Abwehrhaltung drohe sich negativ auf den internationalen Ruf Dänemarks auszuwirken und könne mithin Exportanstrengungen unterminieren.	Land brauchen neu Arbeitskraft solch Abwehrhaltung drohen negativ international Ruf Dänemark auszuwirken mithin exportanstrengungen unterminieren 	['600', '601']	{'6'}
2	20150827	Am Donnerstag hatte das Landgericht Pirna für die Stadt Heidenau per Allgemeinverfügung ein umfassendes Versammlungsverbot verhängt.	Donnerstag Landgericht Pirna Stadt Heidenau per Allgemeinverfügung umfassend Versammlungsverbot verhängen 	['400', '406']	{'4'}
2	20150828	Darin widersprach er dem allgemeinen Demonstrationsverbot, stellte einen Eilantrag und versicherte eidesstattlich, dass er am Willkommensfest teilnehmen wolle.	darin widersprechen allgemein Demonstrationsverbot stellen Eilantrag versichern eidesstattlich Willkommensfest teilnehmen 	['700', '705']	{'7'}
2	20150420	Ausdrücklich verlangen die Verbände auch, die Zuwanderung Qualifizierter zu fördern.	ausdrücklich verlangen Verband Zuwanderung Qualifizierter fördern 	['100', '101', '600', '602']	{'6', '1'}
2	20150828	 Darin widersprach er dem allgemeinen Demonstrationsverbot, stellte einen Eilantrag und versicherte eidesstattlich, dass er am Willkommensfest teilnehmen wolle	  darin widersprechen allgemein Demonstrationsverbot stellen Eilantrag versichern eidesstattlich Willkommensfest teilnehmen 	['400', '406']	{'4'}
2	20151015	Leerstehende Immobilien in Bremen können künftig auch gegen den Willen der Eigentümer für Flüchtlinge genutzt werden.	Leerstehende Immobilie Bremen künftig Wille Eigentümer Flüchtling nutzen 	['200', '205']	{'2'}
2	20150803	Mittels der Medien soll jetzt die Botschaft verbreitet werden, dass Dänemark gänzlich unattraktiv für Flüchtlinge ist.	Mittel Medium sollen Botschaft verbreiten Dänemark gänzlich unattraktiv Flüchtling 	['100', '104']	{'1'}
2	20150828	"Mittags erklärte das VG Dresden, dass die Allgemeinverfügung  ""offensichtlich rechtswidrig""  sei."	Mittags erklären VG Dresden Allgemeinverfügung   offensichtlich rechtswidrig   	['400', '406']	{'4'}
2	20150830	Doch das Landratsamt legte Beschwerde ein. Und am Freitagabend entschied das Oberverwaltungsgericht (OVG) Bautzen, dass das Verbot nur für das Willkommensfest ausgesetzt werde, denn nur daran habe Fengler auch persönlich teilnehmen wollen	Landratsamt legen Beschwerde Freitagabend entscheiden Oberverwaltungsgericht OVG Bautzen Verbot Willkommensfest aussetzen daran Fengler persönlich teilnehmen 	['400', '406']	{'4'}
2	20151011	"""Wir müssen deshalb dafür sorgen, dass wir eine Verfahrensbeschleunigung bekommen und eine schnellere Dezentralisierung"" , betonte der BKA-Chef."	müssen deshalb dafür sorgen Verfahrensbeschleunigung bekommen schnell Dezentralisierung betonen BKA-Chef 	['800', '812']	{'8'}
2	20150830	Fengler aber gab nicht auf. In der Nacht auf Samstag wandte er sich mit einem Eilantrag ans Bundesverfassungsgericht.	Fengler geben Nacht Samstag wenden Eilantrag Bundesverfassungsgericht 	['400', '406']	{'4'}
2	20150829	Am Samstagvormittag hob dieses Gericht den Bautzener Beschluss auf.	Samstagvormittag heben Gericht Bautzener Beschluss 	['400', '406']	{'4'}
2	20150303	" Tätliche Übergriffe konnten die Polizei und mehrere hundert Besucher eines Solidaritätskonzertes verhindern, nicht aber Rufe wie  ""Deutschland den Deutschen"" ."	  Tätliche Übergriff Polizei mehrere hundert Besucher Solidaritätskonzert verhindern Rufe   Deutschland deutsche 	['700', '705']	{'7'}
2	20151011	"""Wir müssen deshalb dafür sorgen, dass wir eine Verfahrensbeschleunigung bekommen und eine schnellere Dezentralisierung"" , betonte der BKA-Chef."	müssen deshalb dafür sorgen Verfahrensbeschleunigung bekommen schnell Dezentralisierung betonen BKA-Chef 	['200', '203', '800', '812']	{'8', '2'}
2	20150303	Anhänger des Pegida-Gründers Lutz Bachmann hatten in Dresden demonstriert. 	Anhänger Pegida-Gründer Lutz Bachmann Dresden demonstrieren 	['700', '711']	{'7'}
2	20151011	Die Spezialisierung der Polizei und die nationale und internationale Zusammenarbeit würden dabei immer wichtiger.	Spezialisierung Polizei national international Zusammenarbeit dabei immer wichtig 	['500', '502', '800', '808']	{'8', '5'}
2	20151011	Eine getrennte Unterbringung, wie das gelegentlich gefordert wird, könne die Probleme sogar noch vergrößern.	getrennt Unterbringung gelegentlich fordern Problem sogar vergrößern 	['200', '203']	{'2'}
2	20150303	"""Für ein weltoffenes Dresden"" , verkündet eine Banderole an der Semperoper."	weltoffen Dresden verkünden Banderole Semperoper 	['700', '715']	{'7'}
2	20150303	"Tätliche Übergriffe konnten die Polizei und mehrere hundert Besucher eines Solidaritätskonzertes verhindern , nicht aber Rufe wie "" Deutschland den Deutschen "" ."	Tätliche Übergriff Polizei mehrere hundert Besucher Solidaritätskonzert verhindern Rufe Deutschland deutsche 	['700', '709']	{'7'}
2	20150303	CDU und AfD begrüßten hingegen die Räumung, die Sachsens neuer Ausländerbeauftragter Geert Mackenroth (CDU) bereits tags zuvor gefordert hatte.	CDU AfD begrüßen hingegen Räumung Sachsen neu Ausländerbeauftragter Geert Mackenroth CDU bereits tags zuvor fordern 	['800', '899']	{'8'}
2	20151227	Finanzminister Wolfgang Schäuble (CDU) will angesichts der Flüchtlingskrise die Ausgaben für europäische Militäreinsätze und die deutsche Entwicklungshilfe steigern.	Finanzminister Wolfgang Schäuble CDU angesichts Flüchtlingskris Ausgabe europäisch Militäreinsatz deutsch Entwicklungshilfe steigern 	['100', '106', '500', '503', '800', '805']	{'8', '5', '1'}
2	20151227	"""Wir werden sehr viel mehr Mittel für gemeinsame europäische Verteidigungsinitiativen aufwenden müssen"", sagte Schäuble der Bild am Sonntag."	mehr Mittel gemeinsam europäisch verteidigungsinitiativen aufwenden müssen sagen Schäuble Bild Sonntag 	['100', '106', '800', '805']	{'8', '1'}
2	20150303	"Für den heutigen Mittwoch hat nun die NPD eine Demonstration unter dem Motto  ""Dresden gehört uns""  angemeldet – ebenfalls auf dem Theaterplatz vor der Semperoper."	heutig Mittwoch NPD Demonstration Motto   Dresden gehören   anmelden ebenfalls Theaterplatz Semperoper 	['700', '705']	{'7'}
2	20151227	"""Wir werden das Tempo, bis wann wir die 0,7 Prozent (des Bruttoinlandsprodukts) erreichen, beschleunigen müssen."	Tempo wann Prozent Bruttoinlandsprodukt erreichen beschleunigen müssen 	['800', '899']	{'8'}
2	20150106	Über die Anti-Islam-Bewegung Pegida in Deutschland wird inzwischen weltweit berichtet, auch Exkanzler und Prominente warnen in Appellen vor Fremdenfeindlichkeit.	Anti-Islam-Bewegung Pegida Deutschland inzwischen weltweit berichten Exkanzler Prominent warnen Appell Fremdenfeindlichkeit 	['700', '703']	{'7'}
2	20151007	"""Abschottung und Abgrenzung im Zeitalter des Internets sind eine Illusion"" , sagte Merkel, betonte aber in derselben Rede die  ""Schlüsselrolle der Türkei"" , auch  ""bei der Grenzsicherung"" ."	Abschottung Abgrenzung Zeitalter Internet Illusion sagen Merkel betonen Rede   Schlüsselrolle Türkei   Grenzsicherung 	['100', '104']	{'1'}
2	20151007	" ""Abschottung und Abgrenzung im Zeitalter des Internets sind eine Illusion"" , sagte Merkel, betonte aber in derselben Rede die  ""Schlüsselrolle der Türkei"" , auch  ""bei der Grenzsicherung"" ."	  Abschottung Abgrenzung Zeitalter Internet Illusion sagen Merkel betonen Rede   Schlüsselrolle Türkei   Grenzsicherung 	['500', '507']	{'5'}
2	20151007	Bundeskanzlerin Angela Merkel hat die Europäer vor einem Rückfall in nationale Antworten bei der Bewältigung der Flüchtlingskrise gewarnt.	Bundeskanzlerin Angela Merkel Europäer Rückfall national Antwort Bewältigung Flüchtlingskrise warnen 	['500', '501']	{'5'}
2	20150105	Aber in vielen anderen Städten überwiegen die Gegendemonstranten	vieler Stadt überwiegen gegendemonstrante 	['700', '703']	{'7'}
2	20151007	Kanzlerin gegen Abschottung und für Grenzsicherung	Kanzlerin Abschottung Grenzsicherung 	['100', '105']	{'1'}
2	20151227	Schäuble will mehr Entwicklungshilfe	Schäuble mehr Entwicklungshilfe 	['500', '503', '800', '805']	{'8', '5'}
2	20151007	Kanzlerin gegen Abschottung und für Grenzsicherung	Kanzlerin Abschottung Grenzsicherung 	['100', '104']	{'1'}
2	20150106	Allein in Köln und Münster gingen gegen Pegida fast 20.000 Bürger auf die Straße, in weiteren Städten insgesamt etwa 10.000.	allein Köln Münster gehen Pegida fast Bürger Straße weit Stadt insgesamt etwa 10.000. 	['700', '703']	{'7'}
2	20150105	Zur ersten Montagsdemo der Pegida im neuen Jahr in Dresden kamen laut Polizei rund 18.000 Teilnehmer.	erster Montagsdemo Pegida neu Jahr Dresden kommen laut Polizei rund Teilnehmer 	['700', '703']	{'7'}
2	20150105	Zur ersten Montagsdemo der Pegida im neuen Jahr in Dresden kamen laut Polizei rund 18.000 Teilnehmer.	erster Montagsdemo Pegida neu Jahr Dresden kommen laut Polizei rund Teilnehmer 	['700', '711']	{'7'}
2	20150621	 5.000 Demonstranten protestieren in Berlin gegen Flüchtlingspolitik der Regierung.	  Demonstrant protestieren Berlin Flüchtlingspolitik Regierung 	['100', '190']	{'1'}
2	20150106	30.000 aktiv gegen Pegida	aktiv Pegida 	['700', '703']	{'7'}
2	20150621	"Ursprünglich hatten Aktivisten des  ""Zentrums für Politische Schönheit""  ein symbolisches  ""Friedhofsfeld der Superlative""  auf dem Vorplatz des Bundeskanzleramts errichten und dort tote Flüchtlinge bestatten wollen."	ursprünglich Aktivist   Zentrum politisch Schönheit   symbolisch   Friedhofsfeld Superlativ   Vorplatz Bundeskanzleramt errichten tot Flüchtling bestatten 	['100', '190']	{'1'}
2	20150620	"""Ich wünschte, die Erinnerung an die geflüchteten und vertriebenen Menschen von damals könnte unser Verständnis für geflüchtete und vertriebene Menschen von heute vertiefen."	wünschen Erinnerung geflüchtet vertrieben Mensch damals Verständnis geflüchtet vertrieben Mensch heute vertiefen 	['700', '705']	{'7'}
2	20150620	"Bundespräsident Joachim Gauck rief die Deutschen am Samstag zu mehr  ""Offenheit für das Leid des Anderen""  auf."	Bundespräsident Joachim Gauck rufen deutsche Samstag mehr   Offenheit Leid   	['700', '715']	{'7'}
2	20151007	Nur mit einem gemeinsamen Vorgehen könnten die EU-Staaten die Außengrenzen der Europäischen Union sichern und die Verteilung der Flüchtlinge regeln.	gemeinsam Vorgehen EU-Staat Außengrenze europäisch Union sichern Verteilung Flüchtling regeln 	['100', '105', '500', '501']	{'5', '1'}
2	20150621	Am ersten deutschen Gedenktag für die Opfer von Flucht und Vertreibung warb er um mehr Hilfe für Flüchtlinge.	erster deutsch Gedenktag Opfer Flucht Vertreibung werben mehr Hilfe Flüchtling 	['700', '705']	{'7'}
2	20150621	" Die Initiative kritisierte die Behördenauflagen als Eingriff in die  ""Kunstfreiheit"" "	  Initiative kritisieren Behördenauflag Eingriff   Kunstfreiheit 	['800', '899']	{'8'}
2	20150105	Auch im neuen Jahr wieder große Pegida-Montagsdemo in Dresden.	neu Jahr groß Pegida-Montagsdemo Dresden 	['700', '711']	{'7'}
2	20150905	Schäuble plant Nachtragsetat	Schäuble planen Nachtragsetat 	['800', '805']	{'8'}
2	20151011	SPD-Fraktionsvize Hubertus Heil hat wegen der Flüchtlingskrise eine bisher durch die Verfassung verbotene Finanzierung der Schulen durch den Bund gefordert.	SPD-Fraktionsvize Hubertus Heil wegen Flüchtlingskris bisher Verfassung verboten Finanzierung Schule Bund fordern 	['800', '802', '805']	{'8'}
2	20150906	Finanzminister Wolfgang Schäuble (CDU) trifft Vorsorge, um die steigenden Kosten der Flüchtlingskrise finanzieren zu können.	Finanzminister Wolfgang Schäuble CDU treffen Vorsorge steigend Kosten Flüchtlingskris finanzieren 	['800', '805']	{'8'}
2	20150906	Ungarn will schon bald seine Grenze dicht machen	Ungarn schon bald Grenze dicht 	['100', '104']	{'1'}
2	20151011	SPD für Ende des Kooperationsverbots	SPD Ende Kooperationsverbot 	['800', '802', '808']	{'8'}
2	20151006	Gegen diesen Auflauf werden Proteste des Bündnisses Dresden Nazifrei und anderer Verteidiger der Menschenrechte vorbereitet	Auflauf Protest Bündnis Dresden Nazifrei Verteidiger Menschenrecht vorbereiten 	['700', '703']	{'7'}
2	20151006	An einer solchen von Tatjana Festerling, ehemals Pegida-Kandidatin für das Dresdner Oberbürgermeisteramt, organisierten symbolischen Grenzschließung beteiligten sich am Sonntag in Sebnitz etwa 3.000 Bürger.	Tatjana Festerling ehemals Pegida-Kandidatin Dresdner Oberbürgermeisteramt organisiert symbolisch Grenzschließung beteiligen Sonntag Sebnitz etwa Bürger 	['100', '104']	{'1'}
2	20151006	In der Vorwoche wurden zwei Journalisten angegriffen und verletzt, woraufhin der MDR und der Deutsche Journalistenverband einen besseren Schutz verlangten.	Vorwoch zwei Journalist angreifen verletzen woraufhin MDR deutsch Journalistenverband gut Schutz verlangen 	['800', '818']	{'8'}
2	20151011	Dazu müsse das sogenannte Kooperationsverbot aus der Verfassung gestrichen werden, heißt es in einem Papier.	müssen sogenannter Kooperationsverbot Verfassung streichen heißen Papier 	['800', '802', '808']	{'8'}
2	20151006	 Gegenbündnis will Jahrestag vermasseln	  Gegenbündnis Jahrestag vermasseln 	['700', '703']	{'7'}
2	20151006	Für den Jahrestag des ersten Pegida-Aufmarschs wird am 19. Oktober eine größere Demonstration in Dresden mit überregionaler Beteiligung erwartet	Jahrestag erster Pegida-Aufmarsch   Oktober groß Demonstration Dresden überregional Beteiligung erwarten 	['700', '711']	{'7'}
2	20151006	"Die Dresdner Bevölkerung müsse sich bekennen, ob sie weiter  ""das Bild einer rechtsoffenen Stadt abgeben""  oder für eine Willkommensgesellschaft eintreten wolle."	Dresdner Bevölkerung müssen bekennen   Bild rechtsoffen Stadt abgeben   Willkommensgesellschaft eintreten 	['700', '708']	{'7'}
2	20151006	Bereits an diesem Montag gab es erstmals wieder eine kleine Gegendemonstration von rund 300 Radfahrern.	bereits Montag geben erstmals klein Gegendemonstration rund Radfahrer 	['700', '703']	{'7'}
2	20151006	"Die Staatsanwaltschaft Dresden wirft ihm Volksverhetzung vor, weil er im September 2014 auf seiner Facebook-Seite Flüchtlinge als  ""Gelumpe""  und  ""Viehzeug""  bezeichnet hatte."	Staatsanwaltschaft Dresden werfen Volksverhetzung September Facebook-Seite Flüchtling   Gelumpe     Viehzeug   bezeichnen 	['700', '703']	{'7'}
2	20151006	"Die Demonstration von 5.000 Asylgegnern der Initiative  ""Wir sind Deutschland""  im vogtländischen Plauen hingegen distanzierte sich von Pegida."	Demonstration Asylgegner Initiative   Deutschland   vogtländisch Plau hingegen distanzieren Pegida 	['100', '110']	{'1'}
2	20151006	"Die Initiative  ""Gepida""  steht für  ""Genervte Einwohner Protestieren gegen Intoleranz Dresdner Außenseiter""  und protestierte mit einem  ""Klingelkonzert der Volksfahrräder"" ."	Initiative   Gepida   stehen   Genervte Einwohner Protestieren Intoleranz Dresdner Außenseiter   protestieren   Klingelkonzert Volksfahrräd 	['700', '715']	{'7'}
2	20151006	Der rechtsintellektuelle Verleger Götz Kubitschek forderte zu Blockaden von Plätzen und Grenzübergängen auf.	rechtsintellektuell Verleger Götz Kubitschek fordern Blockade Platz Grenzübergang 	['100', '104']	{'1'}
2	20151006	In einem 10-Punkte-Programm fordert Pegida einen sofortigen Aufnahmestopp und ein Asyl-Notstandsgesetz.	10-Punkte-Programm fordern Pegida sofortig Aufnahmestopp Asyl-Notstandsgesetz 	['100', '104']	{'1'}
2	20151006	"Die Landesregierung müsse diesem  ""Spuk""  endlich offensiv entgegentreten."	Landesregierung müssen   Spuk   endlich offensiv entgegentreten 	['800', '818']	{'8'}
2	20151006	"Die Demonstration von 5.000 Asylgegnern der Initiative "" Wir sind Deutschland "" im vogtländischen Plauen hingegen distanzierte sich von Pegida ."	Demonstration Asylgegner Initiative Deutschland vogtländisch Plau hingegen distanzieren Pegida 	['700', '701']	{'7'}
2	20151016	"Kommissionschef Jean-Claude Juncker hatte eigens seinen Vize Frits Timmermans nach Ankara geschickt, um einen  ""Aktionsplan""  auszuhandeln."	Kommissionschef Jean-Claude Juncker eigens Vize Frit Timmerman Ankara schicken   Aktionsplan   aushandeln 	['500', '507']	{'5'}
2	20151006	"Das Bündnis  ""Dresden Nazifrei""  kündigt für den 19. Oktober  ""Widerstand""  gegen den Aufzug und eine noch unbekannte  ""Aktion""  an."	Bündnis   Dresden Nazifrei   kündigen   Oktober   Widerstand   Aufzug unbekannt   Aktion   	['700', '703']	{'7'}
2	20151016	Erdoğan fordert zudem, künftig an EU-Gipfeln teilnehmen zu dürfen.	Erdoğan fordern zudem künftig EU-Gipfel teilnehmen dürfen 	['500', '507']	{'5'}
2	20151016	Es komme nicht infrage, der Türkei schon jetzt mehr Einreisevisa nach Europa zu versprechen. 	kommen Infrage Türkei schon mehr Einreisevisa Europa versprechen 	['500', '507']	{'5'}
2	20151016	Auch EU-Ratspräsident Donald Tusk trat auf die Bremse. 	EU-Ratspräsident Donald Tusk treten Bremse 	['500', '507']	{'5'}
2	20151016	"Zudem will er für die Türkei den Status als  ""sicheres Herkunftsland"""	zudem Türkei Status   sicheres Herkunftsland 	['500', '504']	{'5'}
2	20151016	Die Forderungen reichen von einer Verdreifachung der geplanten Finanzhilfe auf 3 Milliarden Euro über eine Beschleunigung der zugesagten Visumerleichterungen bis zu einer Wiederaufnahme der unterbrochenen EU-Beitrittsgespräche.	Forderung reichen Verdreifachung geplant Finanzhilfe   Milliarde Euro Beschleunigung zugesagt Visumerleichterung Wiederaufnahme unterbrochen EU-Beitrittsgespräch 	['100', '113', '500', '507', '800', '805', '899']	{'8', '5', '1'}
2	20151016	Bei der Abriegelung der Grenzen soll vor allem die Türkei helfen, beschlossen Kanzlerin Angela Merkel und ihre 27 Amtskollegen.	Abriegelung Grenze sollen Türkei helfen beschließen Kanzlerin Angela Merkel Amtskollege 	['500', '507']	{'5'}
2	20151016	Neben der Finanzspritze sieht der Plan vor, dass der Kampf gegen Schlepper verstärkt und die Flucht nach Europa erschwert wird.	neben Finanzspritze sehen Plan Kampf Schlepper verstärken Flucht Europa erschweren 	['100', '109', '500', '507', '800', '805']	{'8', '5', '1'}
2	20151016	Die Türkei soll zudem Registrierungszentren errichten und nicht anerkannte Asylbewerber schneller abschieben.	Türkei sollen zudem Registrierungszentr errichten anerkannt Asylbewerber schnell abschieben 	['200', '203', '207', '500', '507', '800', '812']	{'8', '5', '2'}
2	20150922	"Bundeskanzlerin Angela Merkel (CDU) erklärte am Dienstag, sie habe  ""den Eindruck, dass der gesamte Flüchtlingsprozess sehr ungeordnet abläuft, wir müssen und werden ihn trotzdem bewältigen"" ."	Bundeskanzlerin Angela Merkel CDU erklären Dienstag   Eindruck gesamt Flüchtlingsprozess ungeordnen ablaufen müssen trotzdem bewältigen 	['100', '101']	{'1'}
2	20150922	Die EU-Innenminister haben bei ihrem Sondertreffen per Mehrheitsbeschluss die Umverteilung von 120.000 Flüchtlingen beschlossen.	EU-Innenminister sondertreffen per Mehrheitsbeschluss Umverteilung Flüchtling beschließen 	['500', '501']	{'5'}
2	20151115	Mehr Geld für Europas Flüchtlingspolitik	mehr Geld Europa Flüchtlingspolitik 	['800', '805']	{'8'}
2	20150922	Gegen die Umverteilung von Flüchtlingen aus stark belasteten Ankunftsländern wie Italien und Griechenland hatte sich bis zuletzt eine Reihe osteuropäischer Staaten gewehrt.	Umverteilung Flüchtling stark belastet ankunftsländern Italien Griechenland zuletzt Reihe osteuropäisch Staat wehren 	['500', '501']	{'5'}
2	20150922	"Nötig seien dazu aber  ""Signale der Ordnung, dazu gehört die Bewachung der Außengrenze"" ."	nötig   Signal Ordnung gehören Bewachung Außengrenze 	['100', '105']	{'1'}
2	20150922	EU beschließt gegen Stimmen von vier Staaten die Umverteilung von 120.000 Menschen	EU beschließen Stimme vier Staat Umverteilung Mensch 	['500', '501']	{'5'}
2	20150922	"Merkel für  ""Bewachung der Außengrenzen"""	Merkel   Bewachung Außengrenze 	['100', '106']	{'1'}
2	20150922	Laut dem tschechischen Innenminister Milan Chovanec stimmten nun sein Land, Rumänien, die Slowakei und Ungarn dagegen.	laut tschechisch Innenminister Milan Chovanec stimmen Land Rumänien Slowakei Ungarn dagegen 	['500', '501']	{'5'}
2	20150908	| Rot-Rot in Brandenburg pocht darauf, dass die eigentlich für das Betreuungsgeld gedachten Mittel für Kitas verwendet werden.	Rot-Rot Brandenburg pochen darauf eigentlich Betreuungsgeld gedacht Mittel Kitas verwenden 	['900']	{'9'}
2	20150914	Bei seinen künftigen Protesten will das Blockupy-Bündnis, das bislang in erster Linie gegen die europäische Sparpolitik gekämpft hat, den Fokus ebenfalls verstärkt auf die Migrationspolitik legen.	künftig Protest Blockupy-Bündnis bislang erster Linie europäisch Sparpolitik kämpfen Fokus ebenfalls verstärkt Migrationspolitik legen 	['100', '190']	{'1'}
