source	date	quote	quote_lemmatized	values	values_minimal
2	20150126	Mit Leuten, die Ressentiments schürten, gebe es für die Grünen keine Gesprächsgrundlage. 	Leute Ressentiment schüren geben grüne Gesprächsgrundlage 	['700', '701', '703', '712']	{'7'}
2	20151007	"Ein Ende dieses Zustands ist nicht in Sicht, gesteht das Hessische Ministerium für Soziales und Integration:  ""Wir setzen derzeit alles daran, noch in diesem Jahr weitere feste Plätze zu schaffen, aber die Herausforderung ist riesig."""	Ende Zustand Sicht gestehen hessisch Ministerium soziale Integration   setzen derzeit daran Jahr weit fest Platz schaffen Herausforderung riesig 	['200', '202', '204']	{'2'}
2	20151007	Momentan prüfe man landesweit rund 80 Liegenschaften und Unterbringungsmöglichkeiten – darunter Kasernen, aber auch Tragluft-, Leichtbauhallen sowie Container und Holzhäuser.	momentan prüfen landesweit rund   Liegenschaft Unterbringungsmöglichkeit darunter Kaserne Tragluft Leichtbauhall sowie Container Holzhäuser 	['200', '202']	{'2'}
2	20151007	"Bis dahin sollen die Zelte möglichst winterfest gemacht werden, erklärt Harald Merz vom Regierungspräsidium Kassel, wo im Vorort Calden derzeit 1.300 Menschen in Zelten schlafen. Die Wände würden mit Faserplatten isoliert, Dächer stabilisiert, den Menschen mehr Decken und Schlafsäcke zur Verfügung gestellt. Kleinere  ""Familienzelte""  für 12 bis 13 Personen könnten aber lediglich notdürftig beheizt werden."	dahin sollen Zelt möglichst winterfest erklären Harald Merz Regierungspräsidium Kassel Vorort Calde derzeit Mensch Zelte schlafen Wand Faserplatt isolieren Dach stabilisieren Mensch mehr Decke Schlafsäcke Verfügung stellen Kleinere   Familienzelter   Person lediglich notdürftig beheizen 	['300', '309']	{'3'}
2	20151007	Solche kurzfristigen Lösungen reichen nicht, kritisiert Günter Burkhardt, Geschäftsführer von Pro Asyl	kurzfristig Lösung reichen kritisieren Günter Burkhardt Geschäftsführer pro Asyl 	['800', '810']	{'8'}
2	20151007	"Laut Gesetz müssen sie aber zunächst in einer Erstaufnahmeeinrichtung untergebracht werden. Diese Vorgabe nennt Burkhardt ein  ""integrationspolitisches Desaster"" ."	laut Gesetz müssen zunächst Erstaufnahmeeinrichtung unterbringen Vorgabe nennen Burkhardt   integrationspolitisch Desaster 	['200', '203']	{'2'}
2	20151007	"Die zuständige Regierung Oberbayern sieht den kalten Monaten jedenfalls gelassen entgegen:  ""Selbstverständlich werden die Flüchtlinge nicht frieren"" ."	zuständig Regierung Oberbayern sehen kalt Monat jedenfalls gelassen entgegen   selbstverständlich Flüchtling frieren 	['300', '309']	{'3'}
2	20151007	"Man wolle sie durch Container ersetzen, aber deren Beschaffung werde immer schwieriger:  ""Die Nachfrage steigt, die Preise erst recht"" , beklagt Merz. "	Container ersetzen Beschaffung immer schwierig   Nachfrage steigen Preis erst recht beklagen Merz 	['200', '202']	{'2'}
2	20150122	Die Grünen wollen die Kriterien, die bei der Prüfung angewandt werden, konkretisieren, eine Art rote Linie zeichnen, wenn nicht abgeschoben werden darf.	grüne Kriterium Prüfung anwenden konkretisieren Art rot Linie zeichnen abschieben dürfen 	['800', '813']	{'8'}
2	20150122	In Bundesländern, in denen die Grünen in der Opposition sind, etwa in Brandenburg, fordern sie vehement einen Winterabschiebestopp	Bundesland grüne Opposition etwa Brandenburg fordern vehement Winterabschiebestopp 	['200', '207']	{'2'}
2	20150122	Fraktionschefin Edith Sitzmann sagte in Freiburg, sie hätte sich gewünscht, dass das Innenministerium von einer Abschiebung der Freiburger Familie absieht.	Fraktionschefin Edith Sitzmann sagen Freiburg wünschen Innenministerium Abschiebung Freiburger Familie absiehen 	['200', '207']	{'2'}
2	20150122	"Sie fordert vom Innenministerium  ""transparente, verbindliche Kriterien für eine humanitäre Einzelfallprüfung"""	fordern Innenministerium   transparent verbindlich Kriterium humanitär Einzelfallprüfung 	['800', '806', '813']	{'8'}
2	20150122	Die Grünen protestieren, wollen aber nicht gegen Innenminister Reinhold Gall (SPD) vorgehen.	grüne protestieren Innenminister Reinhold Gall SPD vorgehen 	['200', '207']	{'2'}
2	20150122	"In Freiburg, wo sie zuletzt lebten, schwappte die Welle des Protests direkt in den grünen Neujahrsempfang. Demonstranten stürmten die Veranstaltung am Mittwochabend und riefen:  ""Grün-Rot schiebt ab, wir haben’s satt."""	Freiburg zuletzt leben schwappen Welle Protest direkt grün Neujahrsempfang Demonstrant stürmen Veranstaltung Mittwochabend rufen   Grün-Rot schieben ab ’s satt 	['200', '207']	{'2'}
2	20150122	"Das Ministerium teilt auf Anfrage mit:  ""Die Forderungen nach einem Winterabschiebungsstopp sind für uns nicht nachvollziehbar. Zu einem generellen Stopp besteht angesichts des besser geeigneten flexiblen Instruments der Einzelfallprüfung keine Veranlassung – zumal in Belgrad nicht selten wärmere Temperaturen als in Baden-Württemberg herrschen."""	Ministerium teilen Anfrage   Forderung Winterabschiebungsstopp nachvollziehbar generell Stopp bestehen angesichts gut geeignet flexibl Instrument Einzelfallprüfung Veranlassung zumal Belgrad selten wärm Temperatur Baden-Württemberg herrschen 	['200', '207']	{'2'}
2	20150122	Dort hat SPD-Innenminister Boris Pistorius in einem Rückführungserlass unter anderem festgelegt hat, dass Jugendliche, die ein Jahr vor dem Abschluss ihrer Ausbildung stehen, nicht abgeschoben werden.	SPD-Innenminister Boris Pistorius Rückführungserlass festlegen jugendliche Jahr Abschluss Ausbildung stehen abschieben 	['200', '211', '800', '814']	{'8', '2'}
2	20150122	Baden-Württemberg schiebt auch im Winter ab.	Baden-Württemberg schieben Winter ab 	['200', '207']	{'2'}
2	20151007	Deren Sprecher Elias Perabo forderte eine politische Initiative, um den Konflikt zu lösen – aber ohne Assad.	Sprecher Elias Perabo fordern politisch Initiative Konflikt lösen Assad 	['500', '503', '502']	{'5'}
2	20150617	" ""Ich befürworte eine Öffnung der Integrationskurse für Flüchtlinge mit einer sicheren Bleibeperspektive"" , sagt die Integrationsbeauftragte der Union, Cemile Giousouf."	  befürworten Öffnung Integrationskurs Flüchtling sicher Bleibeperspektive sagen Integrationsbeauftragt Union Cemile Giousouf 	['300', '301']	{'3'}
2	20150202	Während der Wirtschaftsflügel der CDU diese Idee begrüßt,	Wirtschaftsflügel CDU Idee begrüßen 	['100', '108']	{'1'}
2	20150216	Die WissenschaftlerInnen fordern, das Bildungssystem zu ändern	WissenschaftlerInnen fordern Bildungssystem ändern 	['300', '399']	{'3'}
2	20150202	Damit will sie die Zuwanderung je nach Arbeitskräftebedarf, Sprachkenntnissen und Ausbildung steuern.	Zuwanderung je Arbeitskräftebedarf Sprachkenntnisse Ausbildung steuern 	['100', '108']	{'1'}
2	20151112	Das alles zu managen, sei ja eigentlich Aufgabe der Regierung und Europas.	managen ja eigentlich Aufgabe Regierung Europa 	['500', '501']	{'5'}
2	20150202	Vorstoß der SPD zu neuem Einwanderungsgesetz	Vorstoß SPD neu Einwanderungsgesetz 	['100', '108']	{'1'}
2	20150202	Arbeitgeber, Gewerkschaften, die Grünen und sogar die AfD sind für ein Einwanderungsgesetz.	Arbeitgeber Gewerkschaft grüne sogar AfD Einwanderungsgesetz 	['100', '108']	{'1'}
2	20150202	Auch Innenminister Thomas de Maizière (CDU) lehnt ein solches Gesetz ab und meint, die gegenwärtigen Regelungen reichten aus.	Innenminister Thomas de Maizière CDU lehnen Gesetz ab gegenwärtig Regelung reichen 	['100', '108']	{'1'}
2	20150202	"""Die CSU darf sich nicht länger der demografischen Realität verweigern"" , forderte Volker Beck (Grüne) am Montag.  ""Entweder die Arbeitskräfte kommen oder die Arbeit geht."" "	CSU dürfen lang demografisch Realität verweigern fordern Volker Beck grüne Montag   entweder Arbeitskraft kommen Arbeit gehen 	['100', '108']	{'1'}
2	20150202	Stattdessen forderte Scheuer die SPD auf, beim Asyl auch Albanien, Kosovo und Montenegro zu sicheren Herkunftsstaaten zu erklären, wie es Bayerns CSU-Innenminister Joachim Herrmann gefordert hatte.	stattdessen fordern Scheuer SPD Asyl Albanien Kosovo Montenegro sicher Herkunftsstaat erklären Bayern CSU-Innenminister Joachim Herrmann fordern 	['500', '504']	{'5'}
2	20150119	SPD-Fraktionschef Thomas Oppermann hatte vor zwei Wochen angekündigt, seine Partei wolle bis Ende Februar ein Konzept für ein Einwanderungsgesetz vorlegen.	SPD-Fraktionschef Thomas Oppermann zwei Woche ankündigen Partei Ende Februar Konzept Einwanderungsgesetz vorlegen 	['100', '108']	{'1'}
2	20150202	SPD-Generalsekretärin Yasmin Fahimi hat die Union am Montag zu Gesprächen über ein Einwanderungsgesetz aufgefordert	SPD-Generalsekretärin Yasmin Fahimi Union Montag Gespräch Einwanderungsgesetz auffordern 	['100', '108']	{'1'}
2	20150202	" ""Wir brauchen keine neuen Zuwanderungsregeln"" , sagte CSU-Landesgruppenchefin Gerda Hasselfeldt am Montag."	  brauchen neu Zuwanderungsregel sagen CSU-Landesgruppenchefin Gerda Hasselfeldt Montag 	['100', '108']	{'1'}
2	20150202	SPD-Fraktionschef Oppermann will Einwanderung nach kanadischem Muster regeln.	SPD-Fraktionschef Oppermann Einwanderung kanadisch Muster regeln 	['100', '108']	{'1'}
2	20150202	ist die CSU dagegen	CSU dagegen 	['100', '108']	{'1'}
2	20150115	Es war der CDU-Generalsekretär Peter Tauber, der im Januar erstmals ein Einwanderungsgesetz ins Spiel gebracht hatte.	CDU-Generalsekretär Peter Tauber Januar erstmals Einwanderungsgesetz Spiel bringen 	['100', '108']	{'1'}
2	20150202	"""Mit der CSU wird es kein Einwanderungsgesetz geben."""	CSU Einwanderungsgesetz geben 	['100', '108']	{'1'}
2	20150202	die CSU stellt sich quer	CSU stellen quer 	['100', '108']	{'1'}
2	20150930	Bundesinnenminister Thomas de Maizière (CDU) will das Personal mehr als verdoppeln und muss darüber mit dem Finanzministerium verhandeln.	Bundesinnenminister Thomas de Maizière CDU Personal mehr verdoppeln darüber Finanzministerium verhandeln 	['800', '804']	{'8'}
2	20150930	Sie will die Zahl der nach Deutschland kommenden Flüchtlinge verringern, indem Asylsuchende dort gleich abgewiesen werden können.	Zahl Deutschland kommend Flüchtling verringern Asylsuchender gleich abweisen 	['100', '102']	{'1'}
2	20150930	De Maizière will künftig außerdem Schnellverfahren an den Landesgrenzen einführen.	De Maizière künftig außerdem Schnellverfahren Landesgrenze einführen 	['800', '812']	{'8'}
2	20150408	Bitte diese Konsequenz beim Schutz von Flüchtlingen	bitte Konsequenz Schutz Flüchtling 	['400', '402']	{'4'}
2	20150408	Gerade Menschen aus den neuen Bundesländern sollten nachvollziehen können, wie falsch und verletzend Vorurteile sein können, und selbst das Auswandern aus wirtschaftlicher Not sollten sie verstehen, wurde das über 20 Jahre von Ost nach West auch praktiziert.	gerade Mensch neu Bundesland sollen nachvollziehen falsch verletzend Vorurteil auswandern wirtschaftlich Not sollen verstehen Jahr Ost West praktizieren 	['700', '703']	{'7'}
2	20150930	Hier müsse mehr Transparenz her	müssen mehr Transparenz her 	['800', '813']	{'8'}
2	20150930	CSU will an der Grenze neue Schnellverfahren	CSU Grenze neu Schnellverfahren 	['800', '812']	{'8'}
2	20150202	Die Linken-Abgeordnete Ulla Jelpke lehnt die Abschiebehaft generell ab,	Linken-Abgeordnete Ulla Jelpke lehnen Abschiebehaft generell ab 	['400', '408']	{'4'}
2	20150331	Um die Arbeitsmarkt-Integration voranzubringen, will Möhle nach der Erfassung der Berufe eine zügige Zusammenarbeit mit der Agentur für Arbeit	Arbeitsmarkt-Integration voranzubringen Möhle Erfassung Berufe zügig Zusammenarbeit Agentur Arbeit 	['600', '608', '800', '808']	{'8', '6'}
2	20150331	"""Wir bauchen eine  Integration von  Anfang an, also schnell eine Wohnung, Deutschkurse  und Arbeit"""	bauchen   Integration   Anfang schnell Wohnung Deutschkurse   Arbeit 	['200', '204', '300', '301', '302', '600', '603']	{'3', '6', '2'}
2	20150331	Hier gebe es bislang Defizite, es müssten mehr Sprachkurse angeboten werden.	geben bislang Defizit müssn mehr Sprachkurs anbieten 	['300', '302']	{'3'}
2	20150331	"Flüchtlinge müssten die Möglichkeit haben, nach drei Monaten freiwillig zu arbeiten"" , meint Möhle."	Flüchtling müssn Möglichkeit drei Monat freiwillig arbeiten Möhle 	['600', '603', '607']	{'6'}
2	20150618	"Ein ganzes Drittel mehr –  ""das wollen und werden wir nicht tun"	ganz Drittel mehr -   tun 	['600', '609']	{'6'}
2	20150618	Leverkusens Stadtkämmerer Frank Stein sieht deshalb den Bund in der Pflicht	Leverkusen Stadtkämmerer Frank Stein sehen deshalb Bund Pflicht 	['800', '802']	{'8'}
2	20150618	An der Steuerschraube zu drehen lehnt er ab	Steuerschraube drehen lehnen ab 	['600', '609']	{'6'}
2	20151201	"Er hatte das Bundesamt für Migration bereits angewiesen, syrische Flüchtlinge nur noch als  ""subsidiär Schutzberechtigte""  zu behandeln"	Bundesamt Migration bereits anweisen syrisch Flüchtling   subsidiär Schutzberechtigte   behandeln 	['200', '210']	{'2'}
2	20151201	"""Wir wollen und brauchen das nicht"""	brauchen 	['300', '309']	{'3'}
2	20151201	Die Einzelfallprüfungen hätten den Vorteil, dass man wieder genau wisse, wer sich im Land aufhalte, sagte Roger Lewentz (SPD) aus Rheinland-Pfalz, Chef der Innenministerkonferenz.	Einzelfallprüfung Vorteil genau wissen wer Land aufhalen sagen Roger Lewentz SPD Rheinland-Pfalz Chef Innenministerkonferenz 	['800', '806']	{'8'}
2	20151201	 mit einem Aufenthaltsrecht von vorerst nur einem Jahr statt drei und ohne Recht auf Familiennachzug	  Aufenthaltsrecht vorerst Jahr statt drei Recht Familiennachzug 	['300', '307']	{'3'}
2	20151201	Die CSU lehnt eine Erweiterung ab	CSU lehnen Erweiterung ab 	['300', '309']	{'3'}
2	20151201	Den Familiennachzug müsse die Bundesregierung klären	Familiennachzug müssen Bundesregierung klären 	['300', '800', '307', '802']	{'8', '3'}
2	20151201	Die SPD will noch zwei EU-Richtlinien integrieren, die Kinder, Schwangere und Kranke unter den Flüchtlingen besser medizinisch versorgen wollen.	SPD zwei EU-Richtlinie integrieren Kind Schwanger kranke Flüchtling gut medizinisch versorgen 	['300', '309']	{'3'}
2	20150104	Die Gesellschaft müsse sich entschlossen gegen diese Stimmungsmache wehren.	Gesellschaft müssen entschließen Stimmungsmache wehren 	['700', '701', '703']	{'7'}
2	20150104	" Es müsse  ""von staatlicher Seite alles getan werden, um die Schuldigen zu finden"" ."	  müssen   staatlich Seite tun Schuldige finden 	['800', '811']	{'8'}
2	20151215	Die Kirchenleitung der evangelischen Nordkirche hat Gesetzesänderungen im deutschen Asylrecht kritisiert.	Kirchenleitung evangelisch Nordkirche Gesetzesänderung deutsch Asylrecht kritisieren 	['100', '190']	{'1'}
2	20150730	"Der Chef der Gewerkschaft der Polizei, Rainer Wendt, hat eine  ""Bannmeile um Flüchtlingsunterkünfte""  gefordert."	Chef Gewerkschaft Polizei Rainer Wendt   Bannmeil Flüchtlingsunterkünfte   fordern 	['400', '406']	{'4'}
2	20151208	Die EU flankiert die Grenzschließungen mit finanziellen Anreizen.	EU flankieren Grenzschließung finanziell Anreiz 	['100', '104', '800', '805']	{'8', '1'}
2	20151208	Einerseits sollen Migranten in Aufnahmezentren dazu bewegt werden, nicht weiterzureisen,	einerseits sollen Migrant Aufnahmezentr bewegen weiterzureisen 	['100', '102', '200', '203']	{'2', '1'}
2	20150701	"So sollen Ausländerbehörden künftig etwa mit einem neu geschaffenen  ""Ausreisegewahrsam""  Flüchtlinge zu deren einfacherer Abschiebung bis zu vier Tage lang festnehmen können."	sollen Ausländerbehörde künftig etwa neu geschaffen   Ausreisegewahrsam   Flüchtling einfacher Abschiebung vier Tag lang festnehmen 	['200', '207', '400', '408']	{'4', '2'}
2	20150918	Da viele Flüchtlinge Smartphones besäßen, werde man versuchen, ihnen bestimmte Apps auf dem Smartphone anzubieten,um das Lernen zu fördern, sagte die Ministerin.	vieler Flüchtling Smartphones besäßen versuchen bestimmt App Smartphone anbieten lernen fördern sagen Ministerin 	['300', '301']	{'3'}
2	20150918	Gleichzeitig kritisiert die Bundesregierung das derzeitige Vorgehen Ungarns, Flüchtlinge an der Grenze abzuweisen, wie Regierungssprecher Steffen Seibert sagte.	gleichzeitig kritisieren Bundesregierung derzeitig vorgehen Ungarn Flüchtling Grenze abzuweisen Regierungssprecher Steffen Seibert sagen 	['100', '104']	{'1'}
2	20150918	Hilfsorganisationen haben das heftig kritisiert.	Hilfsorganisation heftig kritisieren 	['300', '309']	{'3'}
2	20150918	Der Entwurf enthält zahlreiche Ideen zur Leistungskürzung. Darunter befindet sich auch der Vorschlag, dass Flüchtlinge, die über EU-Staaten eingereist waren und gemäß der Dublin-Regelung dorthin zurückgeschickt werden, nur Sachleistungen für den Reisebedarf – etwa Fahrkarte und Proviant – erhalten sollen.	Entwurf enthalten zahlreich Idee Leistungskürzung darunter befinden Vorschlag Flüchtling EU-Staat einreisen gemäß Dublin-Regelung dorthin zurückschicken Sachleistung Reisebedarf etwa Fahrkarte Proviant erhalten sollen 	['300', '309']	{'3'}
2	20150918	Bundesbildungsministerin Johanna Wanka (CDU) betonte am Freitag die Bedeutung des frühen Deutschunterrichts für junge Flüchtlinge: 	Bundesbildungsministerin Johanna Wanka CDU betonen Freitag Bedeutung früh Deutschunterricht jung Flüchtling 	['300', '302']	{'3'}
2	20150918	Der Entwurf enthält zahlreiche Ideen zur Leistungskürzung. Darunter befindet sich auch der Vorschlag, dass Flüchtlinge, die über EU-Staaten eingereist waren und gemäß der Dublin-Regelung dorthin zurückgeschickt werden, nur Sachleistungen für den Reisebedarf – etwa Fahrkarte und Proviant – erhalten sollen.	Entwurf enthalten zahlreich Idee Leistungskürzung darunter befinden Vorschlag Flüchtling EU-Staat einreisen gemäß Dublin-Regelung dorthin zurückschicken Sachleistung Reisebedarf etwa Fahrkarte Proviant erhalten sollen 	['200', '212', '500', '509']	{'5', '2'}
2	20150918	Bundeswirtschaftsminister Sigmar Gabriel (SPD) machte sich am Freitag für die Ausbildung von Flüchtlingen stark. Er wolle sich dafür einsetzen, das junge Flüchtlinge nach dem Abschluss einer Ausbildung auch bei einem negativen Asylbescheid noch zwei Jahre in Deutschland bleiben und arbeiten könnten.	Bundeswirtschaftsminister Sigmar Gabriel SPD Freitag Ausbildung Flüchtling stark dafür einsetzen jung Flüchtling Abschluss Ausbildung negativ Asylbescheid zwei Jahr Deutschland bleiben arbeiten 	['200', '211', '600', '601']	{'6', '2'}
2	20150911	Neoliberale befürworten offene Grenzen, weil sie sich durch Migration Druck auf Löhne versprechen.	Neoliberal befürworten offen Grenze Migration Druck Lohn versprechen 	['100', '105']	{'1'}
2	20150911	Deshalb müsste die EU über zirkuläre Arbeitsmigration nachdenken: befristete Verträge mit Menschen etwa vom Westbalkan.	deshalb müsste EU zirkulär Arbeitsmigration nachdenken befristet Vertrag Mensch etwa Westbalkan 	['600', '604']	{'6'}
2	20151208	Ungarn, Slowenien und zuletzt Mazedonien haben Grenzzäune errichtet, außerdem gilt seit Ende November auf dem gesamten Balkan faktisch die Regelung, nur noch Menschen aus Afghanistan, Irak und Syrien durchzulassen.	Ungarn Slowenien zuletzt Mazedonium Grenzzäune errichten außerdem gelten seit Ende November gesamt Balkan faktisch Regelung Mensch Afghanistan Irak Syrien durchzulassen 	['100', '107']	{'1'}
2	20151130	Beim letzten Gipfel Ende November wurden außerdem der Türkei drei Milliarden Euro zugesagt, wenn sie die Geflüchteten an der Weiterreise nach Westeuropa hindert oder sie zurücknimmt, falls diese doch die Grenze passieren sollten.	letzter Gipfel Ende November außerdem Türkei drei Milliarde Euro zusagen Geflüchtet Weiterreise Westeuropa hindern zurücknehmen falls Grenze passieren sollen 	['500', '507']	{'5'}
2	20151130	Ungarn, Slowenien und zuletzt Mazedonien haben Grenzzäune errichtet, außerdem gilt seit Ende November auf dem gesamten Balkan faktisch die Regelung, nur noch Menschen aus Afghanistan, Irak und Syrien durchzulassen.	Ungarn Slowenien zuletzt Mazedonium Grenzzäune errichten außerdem gelten seit Ende November gesamt Balkan faktisch Regelung Mensch Afghanistan Irak Syrien durchzulassen 	['100', '105']	{'1'}
2	20150701	Der Bundesgerichtshof hatte Neuregelungen gefordert. Einige Flüchtlinge werden etwas bessergestellt, doch viele andere können wesentlich schneller inhaftiert und abgeschoben werden	Bundesgerichtshof Neuregelung fordern Flüchtling bessergestellen vieler wesentlich schnell inhaftieren abschieben 	['200', '207', '800', '812']	{'8', '2'}
2	20150701	"Bislang schieben Behörden nicht fleißig genug ab. Das Ministerium hält es für  ""rechtsstaatlich unbefriedigend"" , dass im Moment nur  ""bei einem sehr kleinen Teil der vollziehbar Ausreisepflichtigen die Ausreisepflicht auch tatsächlich durchgesetzt wird"" ."	bislang schieben Behörde fleißig genug ab Ministerium halten   rechtsstaatlich unbefriedigend Moment   klein Teil vollziehbar Ausreisepflichtig Ausreisepflicht tatsächlich durchsetzen 	['200', '207']	{'2'}
2	20151208	"Bundeskanzlerin Angela Merkel (CDU) ersetzte dabei ihr  ""Wir schaffen das""  durch ein Vorgehen, mit dem eine  ""Steuerung und Begrenzung""  des Flüchtlingsstroms erreicht werden soll."	Bundeskanzlerin Angela Merkel CDU ersetzen dabei   schaffen   vorgehen   Steuerung Begrenzung   Flüchtlingsstrom erreichen sollen 	['100', '102']	{'1'}
2	20150922	Tschechien, die Slowakei und Polen ziehen mit Orbán in der Migrationspolitik an einem Strang. In der sogenannten Višegrad-Gruppe organisieren die vier Länder den Widerstand gegen Junckers Flüchtlingsquoten. 	Tschechien Slowakei Polen ziehen Orbán Migrationspolitik Strang sogenannter Višegrad-Gruppe organisieren vier Land Widerstand Juncker Flüchtlingsquot 	['500', '501']	{'5'}
2	20150922	"Bundestagsvizepräsident Johannes Singhammer (ebenfalls CSU) gab der Kanzlerin schon mal einen Tipp:  ""Mein Rat an die Kanzlerin ist, zu erklären, dass Deutschland derzeit nicht in der Lage ist, weiter größere Zahlen an Flüchtlingen aufzunehmen"" , sagte er der Süddeutschen Zeitung."	Bundestagsvizepräsident Johannes Singhammer ebenfalls CSU geben Kanzlerin schon mal Tipp   Rat Kanzlerin erklären Deutschland derzeit Lage groß Zahl Flüchtling aufnehmen sagen süddeutsch Zeitung 	['100', '102']	{'1'}
2	20150922	" wir konzentrieren uns auf eine solidarische Gesamtlösung"" , sagte der Sprecher von Kommissionspräsident Jean-Claude Juncker."	  konzentrieren solidarisch Gesamtlösung sagen Sprecher Kommissionspräsident Jean-Claude Juncker 	['500', '501']	{'5'}
2	20150101	Die Bundeskanzlerin hat in ihrer TV-Ansprache den Pegida-Demonstranten die Leviten gelesen	Bundeskanzlerin TV-Ansprache Pegida-Demonstrant Levit lesen 	['700', '701']	{'7'}
2	20150922	Zwar kritisierte der Luxemburger ein paar Tage später die neuen Mauern, die durch Europa gehen.	kritisieren Luxemburger paar Tag spät neu Mauer Europa gehen 	['100', '107']	{'1'}
2	20150101	"""Heute rufen manche montags wieder ‚Wir sind das Volk‘. Aber tatsächlich meinen sie: Ihr gehört nicht dazu – wegen eurer Hautfarbe oder eurer Religion""           ""Deshalb sage ich allen, die auf solche Demonstrationen gehen: Folgen Sie denen nicht, die dazu aufrufen!"	heute rufen montags ‚ Volk tatsächlich gehören wegen eur Hautfarbe eur Religion            deshalb sagen Demonstration gehen Folge aufrufen 	['700', '701', '703']	{'7'}
2	20150922	"Dass Grenzen beschützt und bewacht werden, gehört zu den Positionen der EVP"" , sagte Weber"	Grenze beschützen bewachen gehören Position EVP sagen Weber 	['100', '106']	{'1'}
2	20150101	Es ist selbstverständlich,  dass wir Flüchtlingen helfen  und Menschen aufnehmen,  die bei uns Zuflucht suchen	selbstverständlich   Flüchtling helfen   Mensch aufnehmen   Zuflucht suchen 	['700', '705']	{'7'}
2	20151025	" ""Wir werden kein Hotspot für Migranten werden"" , erklärte er."	  Hotspot Migrant erklären 	['100', '104']	{'1'}
2	20150618	Es gibt mancherorts schlicht und ergreifend Fremdenfeindlichkeit und Rassismus, die sich als Sorge maskieren.	geben mancherorts schlicht ergreifend Fremdenfeindlichkeit Rassismus Sorge maskieren 	['700', '703']	{'7'}
2	20150618	Aber ich war und bin durchaus offen für einen freiwilligen Ausgleich, zum Beispiel ein Pledging-Verfahren, das hat bei den Balkan-Flüchtlingen gut funktioniert.	durchaus offen freiwillig Ausgleich Beispiel Pledging-Verfahren Balkan-Flüchtlinge gut funktionieren 	['500', '501']	{'5'}
2	20150618	 Ich habe damals vorgeschlagen, in Nordafrika Aufnahmezentren der EU einzurichten, wo die Flüchtlinge einen Asylantrag stellen können oder ein Zuwanderungsgesuch.	  damals vorschlagen Nordafrika Aufnahmezentr EU einrichten Flüchtling Asylantrag stellen Zuwanderungsgesuch 	['500', '505']	{'5'}
2	20150618	Es gibt Mangelberufe in Deutschland, warum kann man Menschen mit einer solchen Qualifikation nicht einfach durchwinken?	geben Mangelberufe Deutschland warum Mensch Qualifikation einfach durchwinken 	['100', '108', '600', '602']	{'6', '1'}
2	20150618	Sie müssen aber auch einsehen, dass wir begrenzte Möglichkeiten haben und uns nicht übernehmen dürfen.	müssen einsehen begrenzt Möglichkeit übernehmen dürfen 	['700', '704']	{'7'}
2	20150618	Was ich kritisiere, ist etwas ganz anderes: dass wir ein starres System haben, das nicht differenziert und das nicht flexibel ist. Wir haben leider kein Zwei-Türen-System, das einem Flüchtling erlaubt, anstelle eines aussichtslosen Asylgesuchs schlicht einen Antrag auf Aufenthaltserlaubnis zu stellen.	kritisieren ganz starres System differenzieren flexibel leider Zwei-Türen-System Flüchtling erlauben anstelle aussichtslos Asylgesuch schlicht Antrag Aufenthaltserlaubnis stellen 	['100', '108']	{'1'}
